{
  "schema_version": "mesh.credential_egress_policy.v1",
  "environment": "local",
  "records": [
    {
      "secret_name": "CENTAUR_API_KEY",
      "allowed_hosts": [
        "mesh-centaur-adapter",
        "127.0.0.1",
        "localhost"
      ],
      "allowed_locations": {
        "header": [
          "Authorization"
        ],
        "query": [],
        "path": []
      },
      "sandbox_placeholder_only": true,
      "egress_audit_event_id": "evt_centaur_local_proxy_boot"
    }
  ],
  "proof": {
    "proxy_runtime": {
      "runtime": "credential-egress-proxy",
      "proof_mode": "live_proxy_audit",
      "proxy_instance_id": "local-compose-centaur-proxy",
      "last_audit_event_id": "evt_centaur_local_proxy_boot",
      "allowed_hosts": [
        "mesh-centaur-adapter",
        "127.0.0.1",
        "localhost"
      ],
      "sandbox_placeholder_only": true,
      "host_bound_substitution": true,
      "sandbox_env": {
        "CENTAUR_API_KEY": "${secret:CENTAUR_API_KEY}"
      }
    },
    "egress_audit_events": [
      {
        "event_id": "evt_centaur_local_proxy_boot",
        "host": "mesh-centaur-adapter",
        "status": "proxy_policy_loaded"
      }
    ],
    "agent_attempt_outputs": [],
    "sandbox_logs": [
      "credential proxy loaded placeholder-only policy"
    ],
    "exported_artifacts": [],
    "raw_secret_fixture_values": [
      "centaur_real_secret"
    ]
  }
}
